{
  "kind": "event",
  "protocolVersion": "1.0.0",
  "eventId": "30000000-0000-4000-8000-000000000001",
  "sessionId": "20000000-0000-4000-8000-000000000001",
  "sequence": 1,
  "type": "location.updated",
  "occurredAt": "2026-07-11T10:00:02.000Z",
  "payload": { "sampleId": "40000000-0000-4000-8000-000000000001" }
}
